{
  "reportVersion": 1,
  "generator": {
    "conduit": "<VERSION>",
    "rules": [
      {
        "class": "(shared)",
        "rulesVersion": 1,
        "upstream": {
          "name": "kafka",
          "version": "4.2"
        }
      },
      {
        "class": "io.confluent.connect.s3.S3SinkConnector",
        "rulesVersion": 1,
        "upstream": {
          "name": "confluent",
          "version": "12.1.5"
        }
      }
    ]
  },
  "summary": {
    "connectors": 1,
    "keys": 12,
    "translated": 9,
    "approximated": 3,
    "unsupported": 0,
    "blocking": 5
  },
  "connectors": [
    {
      "name": "sink-s3-orders",
      "class": "io.confluent.connect.s3.S3SinkConnector",
      "role": "sink",
      "pipeline": "pipelines/sink-s3-orders.yaml",
      "pipelineStatus": "stopped",
      "target": {
        "source": "builtin:kafka",
        "destination": "builtin:s3"
      },
      "entries": [
        {
          "key": "connector.class",
          "status": "translated",
          "origin": {
            "file": "sink-s3-orders.json",
            "pointer": "/config/connector.class"
          },
          "reason": "Selects the rule file and the Conduit plugins.",
          "blocking": false
        },
        {
          "key": "storage.class",
          "status": "translated",
          "origin": {
            "file": "sink-s3-orders.json",
            "pointer": "/config/storage.class"
          },
          "reason": "The S3 object store.",
          "blocking": false
        },
        {
          "key": "s3.region",
          "status": "translated",
          "origin": {
            "file": "sink-s3-orders.json",
            "pointer": "/config/s3.region"
          },
          "target": {
            "configPath": "/pipelines/0/connectors/1/settings/aws.region"
          },
          "reason": "The bucket region.",
          "blocking": false
        },
        {
          "key": "s3.bucket.name",
          "status": "translated",
          "origin": {
            "file": "sink-s3-orders.json",
            "pointer": "/config/s3.bucket.name"
          },
          "target": {
            "configPath": "/pipelines/0/connectors/1/settings/aws.bucket"
          },
          "reason": "The bucket objects are written to.",
          "blocking": false
        },
        {
          "key": "topics",
          "status": "translated",
          "origin": {
            "file": "sink-s3-orders.json",
            "pointer": "/config/topics"
          },
          "target": {
            "configPath": "/pipelines/0/connectors/0/settings/topics"
          },
          "reason": "Kafka Connect trims the list and splits it on commas with surrounding whitespace; written the same way.",
          "blocking": false
        },
        {
          "key": "flush.size",
          "status": "approximated",
          "origin": {
            "file": "sink-s3-orders.json",
            "pointer": "/config/flush.size"
          },
          "target": {
            "configPath": "/pipelines/0/connectors/1/settings/sdk.batch.size"
          },
          "code": "kc.key_approximated",
          "reason": "Kafka Connect rotates a file after flush.size records; Conduit writes one object per batch, so sdk.batch.size bounds the records per object instead.",
          "blocking": false
        },
        {
          "key": "format.class",
          "status": "approximated",
          "origin": {
            "file": "sink-s3-orders.json",
            "pointer": "/config/format.class"
          },
          "target": {
            "configPath": "/pipelines/0/connectors/1/settings/format"
          },
          "code": "kc.key_approximated",
          "reason": "Conduit's parquet format writes the OpenCDC fields as fixed string columns, GZIP only; Kafka Connect's ParquetFormat writes the record value's own schema.",
          "fix": "Keep this connector on Kafka Connect if consumers read the Parquet schema, or accept the difference with --accept-gaps.",
          "blocking": true
        },
        {
          "key": "partitioner.class",
          "status": "approximated",
          "origin": {
            "file": "sink-s3-orders.json",
            "pointer": "/config/partitioner.class"
          },
          "code": "kc.key_approximated",
          "reason": "Kafka Connect writes objects under topics/<topic>/partition=<n>/; Conduit writes them under <prefix>/<UnixNano>.<ext>, so the object layout differs.",
          "fix": "Keep this connector on Kafka Connect if consumers read the partitioned object keys, or accept the difference with --accept-gaps.",
          "blocking": true
        },
        {
          "key": "key.converter",
          "status": "translated",
          "origin": {
            "file": "sink-s3-orders.json",
            "pointer": "/config/key.converter"
          },
          "reason": "Bytes pass through unchanged.",
          "blocking": false
        },
        {
          "key": "value.converter",
          "status": "translated",
          "origin": {
            "file": "sink-s3-orders.json",
            "pointer": "/config/value.converter"
          },
          "reason": "Bytes pass through unchanged.",
          "blocking": false
        },
        {
          "key": "consumer.override.group.id",
          "status": "translated",
          "origin": {
            "file": "sink-s3-orders.json",
            "pointer": "/config/consumer.override.group.id"
          },
          "target": {
            "configPath": "/pipelines/0/connectors/0/settings/groupID"
          },
          "blocking": false
        },
        {
          "key": "consumer.override.auto.offset.reset",
          "status": "translated",
          "origin": {
            "file": "sink-s3-orders.json",
            "pointer": "/config/consumer.override.auto.offset.reset"
          },
          "target": {
            "configPath": "/pipelines/0/connectors/0/settings/readFromBeginning"
          },
          "blocking": false
        }
      ],
      "notes": [
        {
          "code": "kc.output_shape_differs",
          "reason": "Conduit writes one object per batch as <prefix>/<UnixNano>.<ext>; the Kafka Connect S3 sink names and lays out objects by its partitioner, and its JsonFormat writes the bare record value where Conduit's json format writes one OpenCDC-shaped object per line. Consumers of the exact object keys or line shape break.",
          "fix": "Keep this connector on Kafka Connect if consumers read the object keys or the bare-value JSON lines, or accept the difference with --accept-gaps.",
          "blocking": true,
          "rule": "s3-sink/notes/kc.output_shape_differs"
        },
        {
          "code": "kc.delivery_semantics_differ",
          "reason": "Object names are not deterministic, so a batch that is retried after a failure or a restart is written again as a new object. A reader can see a record twice, never zero times; Kafka Connect's deterministic naming gives exactly-once object keys.",
          "fix": "None needed; consumers should tolerate duplicate objects.",
          "blocking": false,
          "rule": "s3-sink/notes/kc.delivery_semantics_differ"
        },
        {
          "code": "kc.consumer_group_shared",
          "reason": "The pipeline's Kafka source reads in the consumer group orders-archive, the group the Kafka Connect sink commits its offsets to, and resumes from them. While the Kafka Connect connector is still running, both consumers are in the group and Kafka splits the partitions between them, so neither sees every record. Records the sink processed after its last committed offset are read again, so they can reach the destination twice.",
          "fix": "Stop the Kafka Connect connector (PUT /connectors/<name>/stop, or delete it; pausing keeps its group membership) and wait until kafka-consumer-groups --describe --group orders-archive lists no members, then start the pipeline.",
          "blocking": false,
          "rule": "sink-consumer-defaults/cutover"
        },
        {
          "code": "kc.setting_required",
          "reason": "The builtin:kafka source requires servers, and no key of the Kafka Connect config sets it; the pipeline references ${KC_SINK_S3_ORDERS_SOURCE_SERVERS} instead.",
          "fix": "Set KC_SINK_S3_ORDERS_SOURCE_SERVERS in the environment (see secrets.env.template), or pass the worker file with --worker if it holds bootstrap.servers.",
          "blocking": true,
          "rule": "required/source/servers"
        },
        {
          "code": "kc.setting_required",
          "reason": "The builtin:s3 destination requires format, and no key of the Kafka Connect config sets it; the pipeline references ${KC_SINK_S3_ORDERS_DESTINATION_FORMAT} instead.",
          "fix": "Set KC_SINK_S3_ORDERS_DESTINATION_FORMAT in the environment (see secrets.env.template).",
          "blocking": true,
          "rule": "required/destination/format"
        },
        {
          "code": "kc.default_differs",
          "reason": "Kafka Connect does not retry a failed operation by default (errors.retry.timeout=0). Conduit restarts a failed pipeline through pipeline recovery, so a transient failure that stopped the connector may not stop the pipeline.",
          "blocking": false,
          "rule": "shared/defaults/errors.retry.timeout"
        },
        {
          "code": "kc.default_differs",
          "reason": "Kafka Connect's default header converter types header values; Conduit carries headers as metadata strings.",
          "blocking": false,
          "rule": "shared/defaults/header.converter"
        }
      ],
      "transforms": []
    }
  ],
  "acceptedGaps": []
}
